{
  "claimBoundary": "Reliability and security evidence only. Accuracy, generalization, effort reduction, benchmark superiority, and clinical performance remain unproven.",
  "date": "2026-07-25",
  "decision": "KEEP",
  "expectedEffect": "Improved compatibility, reproducibility, and fail-closed behavior; no change to classification or empirical performance.",
  "generatedAt": "2026-07-25T12:00:01+00:00",
  "guardrails": {
    "accuracyClaimAllowed": false,
    "agent4Changed": false,
    "baselineOutputsChanged": false,
    "classificationChanges": 0,
    "exp005SafeLabels": 0
  },
  "hypothesis": "A versioned unified contract path can reproduce legacy M1-M4B-1 artifacts while strengthening security and provenance.",
  "iteration": 15,
  "iterationKind": "reliability_only",
  "normalizedSha256": "9debfdcaa9365581746aff4bf18df3ed53e253b913ad567e9a56896a4615222f",
  "results": {
    "controlledComparisonRows": 27,
    "controlledParity": "PASS",
    "nodeDependencyAudit": "PASS",
    "offlineTestsPassed": 41,
    "pythonDependencyAudit": "PASS",
    "scriptSubtestsPassed": 7,
    "scriptTestsPassed": 102,
    "securityAudit": "PASS",
    "vegoTestsPassed": 108
  },
  "runId": "HLAYER-UNIFIED-HARDENING-V1",
  "schemaVersion": "HLayerIterationManifest-v1",
  "sourceRevision": "a6c2b42a175d51bd209e7e9adddc6d94c2aff872",
  "verdict": "NEUTRAL"
}
